{
  "schemaVersion": 1,
  "releaseId": "example-not-deployable",
  "deployable": false,
  "gitCommit": "0000000000000000000000000000000000000000",
  "backendImage": {
    "registryType": "DOCR",
    "registry": "",
    "repository": "backend",
    "digest": "sha256:0000000000000000000000000000000000000000000000000000000000000000"
  },
  "keycloakImage": {
    "registryType": "DOCR",
    "registry": "",
    "repository": "keycloak",
    "digest": "sha256:0000000000000000000000000000000000000000000000000000000000000000"
  },
  "frontendSha256": "sha256:0000000000000000000000000000000000000000000000000000000000000000",
  "frontendRootSha256": "sha256:0000000000000000000000000000000000000000000000000000000000000000",
  "dependencyLockSha256": {
    "frontend": "sha256:0000000000000000000000000000000000000000000000000000000000000000",
    "backend": "sha256:0000000000000000000000000000000000000000000000000000000000000000",
    "backendDev": "sha256:0000000000000000000000000000000000000000000000000000000000000000"
  },
  "terraformSha256": "sha256:0000000000000000000000000000000000000000000000000000000000000000",
  "appSpecSha256": "sha256:0000000000000000000000000000000000000000000000000000000000000000",
  "alembicHead": "e8a1c3f5b7d9",
  "createdAt": null,
  "reviewedBy": ""
}
